{
  "schema_version": 2,
  "manifest_id": "m15-synthetic-calibration-states-v2",
  "rule_id": "m15-synthetic-calibration-state-v2",
  "construction": {
    "algorithm_id": "public-observation-grid-v2",
    "field_order": [
      "turn_index",
      "active_slot_count",
      "request_kind",
      "weather_class"
    ],
    "enumeration_order": "lexicographic_over_declared_domains",
    "public_fields_only": true,
    "declared_domains": {
      "turn_index": [
        0,
        1,
        2
      ],
      "active_slot_count": [
        1
      ],
      "request_kind": [
        "move",
        "switch"
      ],
      "weather_class": [
        "none",
        "sun"
      ]
    },
    "state_set": "explicit_public_executable_inputs_v1"
  },
  "states": [
    {
      "state_id": "sha256:75489410965bffa18877ad5bd21bba928708757077ac1bba9791b212aa5a2d02",
      "public_state": {
        "turn_index": 0,
        "active_slot_count": 1,
        "request_kind": "move",
        "weather_class": "none"
      },
      "public_observed_state": {
        "event_index": 0,
        "turn": 0,
        "battle_started": true,
        "our_side": "p1",
        "weather": "none",
        "rules": [
          "gen9ou"
        ],
        "field_conditions": [],
        "p1": {
          "side_id": "p1",
          "team_size": 6,
          "active_slot": 1,
          "pokemon": [
            {
              "slot": 1,
              "details": "Pikachu, L50",
              "active": true,
              "hp": {
                "current": 100,
                "maximum": 100,
                "precision": "exact",
                "fainted": false
              },
              "revealed_moves": [
                "tackle"
              ]
            }
          ]
        },
        "p2": {
          "side_id": "p2",
          "team_size": 6,
          "active_slot": 1,
          "pokemon": [
            {
              "slot": 1,
              "details": "Bulbasaur, L50",
              "active": true,
              "hp": {
                "current": 100,
                "maximum": 100,
                "precision": "exact",
                "fainted": false
              },
              "revealed_moves": []
            }
          ]
        },
        "visible_evidence": [],
        "ignored_display_count": 0
      },
      "decision_request": {
        "identity": {
          "rqid": 1,
          "request_digest": "sha256:e7ff691090c36620293c7974aff12ced1d720efcbefe40b4b37dc0ac79d8100a"
        },
        "kind": "move",
        "side_id": "p1",
        "team_member_count": 6,
        "active_identity": "fixture-p1-slot-1",
        "is_update": false
      },
      "safe_submission_set": {
        "request_identity": {
          "rqid": 1,
          "request_digest": "sha256:e7ff691090c36620293c7974aff12ced1d720efcbefe40b4b37dc0ac79d8100a"
        },
        "submissions": [
          {
            "kind": "move",
            "provenance": "explicit_request",
            "slot": 1,
            "move_id": "tackle",
            "terastallize": false,
            "team_order": []
          }
        ]
      },
      "inputs_digest": "sha256:ccb86c7df1be34bb6df68ccc8f1595a536f129b864b5b7f2d6cf4d0b27bb5c46"
    },
    {
      "state_id": "sha256:f3d4d36c1d6e68144a629ddf113acfffbe3595ca1a373ed0263070b3ce5c2546",
      "public_state": {
        "turn_index": 0,
        "active_slot_count": 1,
        "request_kind": "move",
        "weather_class": "sun"
      },
      "public_observed_state": {
        "event_index": 0,
        "turn": 0,
        "battle_started": true,
        "our_side": "p1",
        "weather": "sun",
        "rules": [
          "gen9ou"
        ],
        "field_conditions": [],
        "p1": {
          "side_id": "p1",
          "team_size": 6,
          "active_slot": 1,
          "pokemon": [
            {
              "slot": 1,
              "details": "Pikachu, L50",
              "active": true,
              "hp": {
                "current": 100,
                "maximum": 100,
                "precision": "exact",
                "fainted": false
              },
              "revealed_moves": [
                "tackle"
              ]
            }
          ]
        },
        "p2": {
          "side_id": "p2",
          "team_size": 6,
          "active_slot": 1,
          "pokemon": [
            {
              "slot": 1,
              "details": "Bulbasaur, L50",
              "active": true,
              "hp": {
                "current": 100,
                "maximum": 100,
                "precision": "exact",
                "fainted": false
              },
              "revealed_moves": []
            }
          ]
        },
        "visible_evidence": [],
        "ignored_display_count": 0
      },
      "decision_request": {
        "identity": {
          "rqid": 1,
          "request_digest": "sha256:4de79ecbef75d4da26212464341012f8569a7a4f9ae16f5b73622c3cfcf69348"
        },
        "kind": "move",
        "side_id": "p1",
        "team_member_count": 6,
        "active_identity": "fixture-p1-slot-1",
        "is_update": false
      },
      "safe_submission_set": {
        "request_identity": {
          "rqid": 1,
          "request_digest": "sha256:4de79ecbef75d4da26212464341012f8569a7a4f9ae16f5b73622c3cfcf69348"
        },
        "submissions": [
          {
            "kind": "move",
            "provenance": "explicit_request",
            "slot": 1,
            "move_id": "tackle",
            "terastallize": false,
            "team_order": []
          }
        ]
      },
      "inputs_digest": "sha256:b8d3a4bd4c3cc96313235598578ffca8c00c9fabbc5056460184a709205ad025"
    },
    {
      "state_id": "sha256:5c6576bdd7baf9130b3fa97c9ce656829321334e830a494497f36d556794d047",
      "public_state": {
        "turn_index": 0,
        "active_slot_count": 1,
        "request_kind": "switch",
        "weather_class": "none"
      },
      "public_observed_state": {
        "event_index": 0,
        "turn": 0,
        "battle_started": true,
        "our_side": "p1",
        "weather": "none",
        "rules": [
          "gen9ou"
        ],
        "field_conditions": [],
        "p1": {
          "side_id": "p1",
          "team_size": 6,
          "active_slot": 1,
          "pokemon": [
            {
              "slot": 1,
              "details": "Pikachu, L50",
              "active": true,
              "hp": {
                "current": 100,
                "maximum": 100,
                "precision": "exact",
                "fainted": false
              },
              "revealed_moves": [
                "tackle"
              ]
            }
          ]
        },
        "p2": {
          "side_id": "p2",
          "team_size": 6,
          "active_slot": 1,
          "pokemon": [
            {
              "slot": 1,
              "details": "Bulbasaur, L50",
              "active": true,
              "hp": {
                "current": 100,
                "maximum": 100,
                "precision": "exact",
                "fainted": false
              },
              "revealed_moves": []
            }
          ]
        },
        "visible_evidence": [],
        "ignored_display_count": 0
      },
      "decision_request": {
        "identity": {
          "rqid": 1,
          "request_digest": "sha256:66e305469620f5f573ccdad4ca71fff7124fe4a65e260b926bf99bd6d4098b0e"
        },
        "kind": "forced_switch",
        "side_id": "p1",
        "team_member_count": 6,
        "active_identity": "fixture-p1-slot-1",
        "is_update": false
      },
      "safe_submission_set": {
        "request_identity": {
          "rqid": 1,
          "request_digest": "sha256:66e305469620f5f573ccdad4ca71fff7124fe4a65e260b926bf99bd6d4098b0e"
        },
        "submissions": [
          {
            "kind": "switch",
            "provenance": "explicit_request",
            "slot": 2,
            "move_id": null,
            "terastallize": false,
            "team_order": []
          }
        ]
      },
      "inputs_digest": "sha256:4966e3c7d420d3a4ce57b0efdb838c3c783877f1983621dee4614bb784e28a21"
    },
    {
      "state_id": "sha256:40e1f5cb7a3145fc84dc5674bc27020c01aba8d9938c8f8f1cc45240ef716aac",
      "public_state": {
        "turn_index": 0,
        "active_slot_count": 1,
        "request_kind": "switch",
        "weather_class": "sun"
      },
      "public_observed_state": {
        "event_index": 0,
        "turn": 0,
        "battle_started": true,
        "our_side": "p1",
        "weather": "sun",
        "rules": [
          "gen9ou"
        ],
        "field_conditions": [],
        "p1": {
          "side_id": "p1",
          "team_size": 6,
          "active_slot": 1,
          "pokemon": [
            {
              "slot": 1,
              "details": "Pikachu, L50",
              "active": true,
              "hp": {
                "current": 100,
                "maximum": 100,
                "precision": "exact",
                "fainted": false
              },
              "revealed_moves": [
                "tackle"
              ]
            }
          ]
        },
        "p2": {
          "side_id": "p2",
          "team_size": 6,
          "active_slot": 1,
          "pokemon": [
            {
              "slot": 1,
              "details": "Bulbasaur, L50",
              "active": true,
              "hp": {
                "current": 100,
                "maximum": 100,
                "precision": "exact",
                "fainted": false
              },
              "revealed_moves": []
            }
          ]
        },
        "visible_evidence": [],
        "ignored_display_count": 0
      },
      "decision_request": {
        "identity": {
          "rqid": 1,
          "request_digest": "sha256:ae3d4985fee26110984f868976c55c4f6c2cd3017f2327b4b1a37b1cd08e4071"
        },
        "kind": "forced_switch",